WorkItemId,ProductStatus,DeliveredScope,OpenScope,EvidenceReference
DIAG-003,IMPLEMENTED_ACTIONS_GATE,"Canonical source-time-status parameter evidence for single-plan and multi-plan analysis with preserved legacy output and three-version semantic tests","",AI_Metadata/Internal_Documentation/Architecture/Diagnostic_Information_Enrichment_Backlog.md
DIAG-004,IMPLEMENTED_ACTIONS_GATE,"Canonical snapshotStatus requestContext statements batches and inputBuffers contracts plus one invocation-local evidence snapshot consumed by Sessions Requests Blocking Waits Transactions Memory Grants TempDB and IO","",AI_Metadata/Internal_Documentation/Architecture/Diagnostic_Information_Enrichment_Backlog.md
DIAG-005,IMPLEMENTED_ACTIONS_GATE,"Canonical plan warnings optimizer and cache context runtime feedback targeted Query Store context and feedback or variant result sets with provenance privacy and false-positive boundaries","",AI_Metadata/Internal_Documentation/Architecture/Diagnostic_Information_Enrichment_Backlog.md
RUNTIME-001,IMPLEMENTED_EXTERNAL_EVIDENCE_PENDING,"Portable read-only External Runtime and SQL CLR Current-State modules","Platform matrix with activated runtime features and controlled synthetic SAFE assembly evidence",Documentation/Architecture/External_Runtime_CLR_Analysis_Plan.md
SC-023,IMPLEMENTED_ACTIONS_GATE,"Restart-safe performance-counter snapshot baseline slice with installer retention budget and three-version runtime gate","",Documentation/Architecture/Snapshot_Baseline_Package_Contract.md
SC-023-EXPANSION,OPTIONAL_FUTURE,"","Additional collectors rollups and optional scheduler or export packages",Documentation/Architecture/Snapshot_Baseline_Package_Contract.md
